{
  "v": 0,
  "type": "lease.revoked",
  "ts_ms": 1755100031000,
  "payload": {
    "lease_id": "ls_9f8e7d6c5b4a3210",
    "robot_id": "r_1a2b3c4d",
    "reason": "expired",
    "help": {
      "reason": "nav_goal_failed",
      "context": { "attempts": 3 },
      "requested_at_ms": 1755100002000
    }
  }
}
